{
  "status": "REAL",
  "timestamp": "2026-07-26T23:38:12.780Z",
  "repository": "T4H001/new-account-loop-engineering-runtime",
  "workflow": "Runtime Receipt Proof",
  "run_id": "30225662859",
  "commit_sha": "a568620ef7c30339a0c86f50976885b191537dbd",
  "duration_seconds": null,
  "evidence": {
    "runner": true,
    "checkout": true,
    "receipt_written": true,
    "artifact_uploaded": true,
    "validation_passed": true
  },
  "classification": "REAL",
  "gaps": [],
  "recovery_action": "rerun workflow_dispatch if receipt or artifact is missing",
  "next_action": "append to ledger and schedule survivability replay"
}